{
  "version": 1,
  "base_campaign": {
    "format": 1,
    "id": "c1",
    "revision": 1,
    "created_at": "2026-09-01T00:00:00Z",
    "priority": 1,
    "template": "interstitial",
    "content": {
      "title": "Hello",
      "message": "Welcome",
      "image": {
        "portrait": null,
        "landscape": null
      },
      "colors": {},
      "close_button": true,
      "backdrop": "dim",
      "buttons": [],
      "tap_action": null
    },
    "triggers": [
      {
        "type": "event",
        "name": "cart_viewed"
      }
    ],
    "conditions": [],
    "caps": {
      "session": null,
      "day": null,
      "week": null,
      "lifetime": null,
      "ignore_global": false
    },
    "schedule": {
      "start_at": "2026-09-01T00:00:00Z",
      "end_at": null,
      "days": null,
      "from": null,
      "to": null
    },
    "delay_seconds": 0,
    "delivery_mode": "device",
    "variants": null,
    "control_group": null,
    "conversion": null
  },
  "base_device": {
    "platform": "ios",
    "app_version": "2.1.0",
    "os_version": "17.2",
    "language": "en",
    "first_seen_at": "2026-08-01T00:00:00Z",
    "utc_offset_minutes": 0,
    "user": {
      "first_name": "Ana",
      "plan": "pro",
      "age": 31
    },
    "unsupported_templates": [],
    "unsupported_actions": [],
    "orientation": "portrait"
  },
  "base_case": {
    "global_caps": {
      "session": 10,
      "day": 10
    },
    "synced_at": "2026-10-01T09:00:00Z",
    "not_ready": []
  },
  "cases": [
    {
      "name": "an event trigger shows the campaign",
      "campaigns": [
        {}
      ],
      "steps": [
        {
          "at": "2026-10-01T10:00:00Z",
          "event": {
            "type": "event",
            "name": "cart_viewed"
          },
          "expect": {
            "show": "c1",
            "reasons": {},
            "title": "Hello",
            "message": "Welcome"
          }
        },
        {
          "at": "2026-10-01T10:01:00Z",
          "event": {
            "type": "event",
            "name": "Cart_Viewed"
          },
          "expect": {
            "show": null,
            "reasons": {
              "c1": "no_trigger"
            }
          }
        },
        {
          "at": "2026-10-01T10:02:00Z",
          "event": {
            "type": "screen_view",
            "name": "cart_viewed"
          },
          "expect": {
            "show": null,
            "reasons": {
              "c1": "no_trigger"
            }
          }
        }
      ]
    },
    {
      "name": "a numeric filter needs a number and a present property",
      "campaigns": [
        {
          "triggers": [
            {
              "type": "event",
              "name": "cart_viewed",
              "filters": [
                {
                  "field": "total",
                  "op": "gt",
                  "value": 50
                }
              ]
            }
          ]
        }
      ],
      "steps": [
        {
          "at": "2026-10-01T10:00:00Z",
          "event": {
            "type": "event",
            "name": "cart_viewed",
            "properties": {
              "total": 80
            }
          },
          "expect": {
            "show": "c1",
            "reasons": {}
          }
        },
        {
          "at": "2026-10-01T10:01:00Z",
          "event": {
            "type": "event",
            "name": "cart_viewed",
            "properties": {
              "total": "80.5"
            }
          },
          "expect": {
            "show": "c1",
            "reasons": {}
          }
        },
        {
          "at": "2026-10-01T10:02:00Z",
          "event": {
            "type": "event",
            "name": "cart_viewed",
            "properties": {
              "total": 50
            }
          },
          "expect": {
            "show": null,
            "reasons": {
              "c1": "no_trigger"
            }
          }
        },
        {
          "at": "2026-10-01T10:03:00Z",
          "event": {
            "type": "event",
            "name": "cart_viewed",
            "properties": {
              "total": "lots"
            }
          },
          "expect": {
            "show": null,
            "reasons": {
              "c1": "no_trigger"
            }
          }
        },
        {
          "at": "2026-10-01T10:04:00Z",
          "event": {
            "type": "event",
            "name": "cart_viewed",
            "properties": {}
          },
          "expect": {
            "show": null,
            "reasons": {
              "c1": "no_trigger"
            }
          }
        }
      ]
    },
    {
      "name": "every filter operator",
      "campaigns": [
        {
          "id": "eq",
          "priority": 9,
          "triggers": [
            {
              "type": "event",
              "name": "probe",
              "filters": [
                {
                  "field": "v",
                  "op": "eq",
                  "value": "red"
                }
              ]
            }
          ]
        },
        {
          "id": "neq",
          "priority": 8,
          "triggers": [
            {
              "type": "event",
              "name": "probe",
              "filters": [
                {
                  "field": "v",
                  "op": "neq",
                  "value": "red"
                }
              ]
            }
          ]
        },
        {
          "id": "contains",
          "priority": 7,
          "triggers": [
            {
              "type": "event",
              "name": "probe",
              "filters": [
                {
                  "field": "v",
                  "op": "contains",
                  "value": "re"
                }
              ]
            }
          ]
        },
        {
          "id": "not_contains",
          "priority": 6,
          "triggers": [
            {
              "type": "event",
              "name": "probe",
              "filters": [
                {
                  "field": "v",
                  "op": "not_contains",
                  "value": "re"
                }
              ]
            }
          ]
        },
        {
          "id": "between",
          "priority": 5,
          "triggers": [
            {
              "type": "event",
              "name": "probe",
              "filters": [
                {
                  "field": "v",
                  "op": "between",
                  "value": [
                    1,
                    5
                  ]
                }
              ]
            }
          ]
        },
        {
          "id": "lt",
          "priority": 4,
          "triggers": [
            {
              "type": "event",
              "name": "probe",
              "filters": [
                {
                  "field": "v",
                  "op": "lt",
                  "value": 3
                }
              ]
            }
          ]
        },
        {
          "id": "is_set",
          "priority": 3,
          "triggers": [
            {
              "type": "event",
              "name": "probe",
              "filters": [
                {
                  "field": "v",
                  "op": "is_set"
                }
              ]
            }
          ]
        },
        {
          "id": "is_not_set",
          "priority": 2,
          "triggers": [
            {
              "type": "event",
              "name": "probe",
              "filters": [
                {
                  "field": "v",
                  "op": "is_not_set"
                }
              ]
            }
          ]
        }
      ],
      "steps": [
        {
          "at": "2026-10-01T10:00:00Z",
          "event": {
            "type": "event",
            "name": "probe",
            "properties": {
              "v": "Red"
            }
          },
          "expect": {
            "show": "eq",
            "reasons": {
              "neq": "no_trigger",
              "contains": "lower_priority",
              "not_contains": "no_trigger",
              "between": "no_trigger",
              "lt": "no_trigger",
              "is_set": "lower_priority",
              "is_not_set": "no_trigger"
            }
          }
        },
        {
          "at": "2026-10-01T10:01:00Z",
          "event": {
            "type": "event",
            "name": "probe",
            "properties": {
              "v": 2
            }
          },
          "expect": {
            "show": "neq",
            "reasons": {
              "eq": "no_trigger",
              "contains": "no_trigger",
              "not_contains": "lower_priority",
              "between": "lower_priority",
              "lt": "lower_priority",
              "is_set": "lower_priority",
              "is_not_set": "no_trigger"
            }
          }
        },
        {
          "at": "2026-10-01T10:02:00Z",
          "event": {
            "type": "event",
            "name": "probe",
            "properties": {
              "v": 5
            }
          },
          "expect": {
            "show": "neq",
            "reasons": {
              "eq": "no_trigger",
              "contains": "no_trigger",
              "not_contains": "lower_priority",
              "between": "lower_priority",
              "lt": "no_trigger",
              "is_set": "lower_priority",
              "is_not_set": "no_trigger"
            }
          }
        },
        {
          "at": "2026-10-01T10:03:00Z",
          "event": {
            "type": "event",
            "name": "probe",
            "properties": {
              "v": ""
            }
          },
          "expect": {
            "show": "is_not_set",
            "reasons": {
              "eq": "no_trigger",
              "neq": "no_trigger",
              "contains": "no_trigger",